{
  "assignmentVersion": "oran-aic-execution-profile-assignment/1.0.1",
  "contractProfile": "oran-aic/1.0.1",
  "schemaRef": "urn:oran-aic:schema:execution-profile-assignment:1.0.1",
  "normative": true,
  "contractDocumentRef": "02-rapp-xapp-backend-mandatory-contract.1.0.1.md",
  "contractDocumentSection": "17.3",
  "catalogRef": "scenario-catalog.1.0.1.json",
  "runnerContractRef": "scenario-runner-contract.1.0.1.json",
  "scenarioIdIsAuthoritative": true,
  "catalogPointerRule": "catalogPointer는 scenarioId가 가리키는 catalog 항목의 편의 좌표다. scenarioId가 권위이며, pointer가 해당 scenarioId를 가리키지 않으면 preflight는 target call 전에 fail-closed한다. fixtureMode와 fixtureSource.mode는 standalone profile 선택을 위해 catalog 값을 복제한 fail-closed snapshot이며, runner는 두 값 모두를 catalogPointer의 scenario.fixtureMode에서 파생해 동치 검증하고 불일치 시 target call 전에 실패한다.",
  "inferenceProhibited": true,
  "inferenceRule": "하위 측은 profile을 추론하거나 로컬 default를 생성하지 않는다. 이 문서에 배정이 없는 scenario는 실행하지 않고 blocker로 보고한다. profile 검증(문서 digest 확인 + 배정 조회)이 끝나기 전에는 어떤 target call도 하지 않는다.",
  "hardwareAuthorization": {
    "usrp": "NOT_AUTHORIZED",
    "ota": "NOT_AUTHORIZED",
    "liveE2Control": "NOT_AUTHORIZED",
    "liveRanWrite": "NOT_AUTHORIZED",
    "note": "이 문서의 어떤 profile도 USRP·OTA·live E2 control·live RAN write를 승인하지 않는다. `live-O1`도 예외가 아니다."
  },
  "profiles": {
    "lower-local": {
      "semantics": "하위가 소유한 구현을 deterministic local adapter/stub/fault harness와 shared bundle fixture만으로 실행한다.",
      "requiresUpperSuppliedCounterpart": false,
      "requiresSeparateAuthority": false,
      "permittedTargetKinds": [
        "LOCAL_DETERMINISTIC_STUB",
        "LOCAL_FAULT_HARNESS",
        "LOWER_BUILT_CONTRACT_FAITHFUL_HARNESS",
        "LOWER_OWNED_IMPLEMENTATION_UNDER_TEST"
      ],
      "prohibitedTargetKinds": [
        "LIVE_E2_CONTROL",
        "LIVE_RAN_WRITE",
        "OTA_TRANSMISSION",
        "PEER_INTERNAL_SOURCE_IMPORT",
        "UPPER_PRODUCTION_DEPLOYMENT",
        "USRP_RADIO"
      ],
      "evidenceProducer": "LOWER_SIDE_CONFORMANCE_RUNNER",
      "scenarioCount": 69
    },
    "bilateral-mock": {
      "semantics": "양측이 합의한 mock endpoint에 실행하고 capture를 양측이 합의한다. 상위가 자신의 contract mock endpoint를 제공해야 시작할 수 있다.",
      "requiresUpperSuppliedCounterpart": true,
      "requiresSeparateAuthority": false,
      "permittedTargetKinds": [
        "AGREED_BILATERAL_MOCK_ENDPOINT",
        "LOCAL_DETERMINISTIC_STUB",
        "LOCAL_FAULT_HARNESS",
        "LOWER_OWNED_IMPLEMENTATION_UNDER_TEST"
      ],
      "prohibitedTargetKinds": [
        "LIVE_E2_CONTROL",
        "LIVE_RAN_WRITE",
        "OTA_TRANSMISSION",
        "PEER_INTERNAL_SOURCE_IMPORT",
        "UPPER_PRODUCTION_DEPLOYMENT",
        "USRP_RADIO"
      ],
      "evidenceProducer": "LOWER_SIDE_CONFORMANCE_RUNNER_WITH_UPPER_AGREED_CAPTURE",
      "scenarioCount": 4
    },
    "live-O1": {
      "semantics": "별도 live-O1 authority가 승인한 Provider/Consumer harness로 live O1 출력을 검증한다. live 범위는 O1 NETCONF/YANG, FileDataReportingMnS, notification, SFTP와 PM file에 한정된다.",
      "requiresUpperSuppliedCounterpart": true,
      "requiresSeparateAuthority": true,
      "authorityToken": "LIVE_O1_PROVIDER_VERIFICATION_AUTHORITY",
      "liveScope": [
        "O1_FILE_DATA_REPORTING_MNS",
        "O1_NETCONF_YANG",
        "O1_NOTIFICATION",
        "O1_PM_FILE",
        "O1_SFTP"
      ],
      "notAnApprovalFor": [
        "LIVE_E2_CONTROL",
        "LIVE_RAN_WRITE",
        "OTA_TRANSMISSION",
        "USRP_RADIO"
      ],
      "permittedTargetKinds": [
        "AGREED_BILATERAL_MOCK_ENDPOINT",
        "LIVE_O1_PROVIDER_UNDER_SEPARATE_AUTHORITY",
        "LOCAL_DETERMINISTIC_STUB",
        "LOWER_OWNED_IMPLEMENTATION_UNDER_TEST"
      ],
      "prohibitedTargetKinds": [
        "LIVE_E2_CONTROL",
        "LIVE_RAN_WRITE",
        "OTA_TRANSMISSION",
        "PEER_INTERNAL_SOURCE_IMPORT",
        "UPPER_PRODUCTION_DEPLOYMENT",
        "USRP_RADIO"
      ],
      "evidenceProducer": "LOWER_SIDE_CONFORMANCE_RUNNER_UNDER_LIVE_O1_AUTHORITY",
      "scenarioCount": 1
    }
  },
  "counts": {
    "catalogScenarioCount": 101,
    "lowerExecutionScenarioCount": 74,
    "notApplicableToLowerCount": 27,
    "byProfile": {
      "lower-local": 69,
      "bilateral-mock": 4,
      "live-O1": 1
    }
  },
  "derivedFrom": {
    "frozenCatalog": {
      "path": "shared-contract-bundle/scenario-catalog.1.0.0.json",
      "byteSha256": "051f381dc15fa951935c6913a7269714c17c40942b52b2b45b978b6a8eb795ba",
      "rule": "하위 실행 대상 74개는 catalog suiteCatalog의 target 소유자가 하위 측인 suite (a1p-producer-conformance, end-to-end-contract, o1-lifecycle-contract, o1-provider-profile-conformance)의 합집합이다."
    },
    "lowerEvidence": {
      "archive": "contract-1.0.0-failure-evidence.tar",
      "archiveByteSha256": "5ee0e7d2938b875425d23c70609527a034a5caef71af4e4ca2f585946c9056d8",
      "member": "contract-1.0.0-failure-evidence/scenario-implementation-matrix.json",
      "memberByteSha256": "86027d89eb61752c5d4d9b1e73bd5fe9c6745d48d2318e68d4400dd22204f1b0",
      "dependencyClassCounts": {
        "HARDWARE_FREE_LOWER_PHASE_A": 67,
        "WAIT_FOR_CORRECTED_1.0.1": 2,
        "UPPER_CONTRACT_MOCK_OR_FINAL_INTEGRATION": 4,
        "FINAL_INTEGRATION_LIVE_O1_INVARIANT": 1
      }
    },
    "diagnosis": {
      "path": "diagnosis/1.0.0/mismatch-matrix.json",
      "entryScenarioId": "EXECUTION-PROFILE",
      "jsonPointer": "/files"
    }
  },
  "assignments": [
    {
      "scenarioId": "SC-001",
      "catalogPointer": "/scenarios/0",
      "suite": "a1p-producer-conformance",
      "fixtureMode": "EXACT_BUNDLE",
      "executionProfile": "lower-local",
      "executedBy": "LOWER_SIDE_CONFORMANCE_RUNNER",
      "targetOwner": "LOWER_SIDE",
      "suiteTargetToken": "A1_P_PRODUCER",
      "selectedTargetRole": "A1_P_PRODUCER",
      "counterpartRole": "A1_CONSUMER_BLACK_BOX_HARNESS",
      "counterpartProvisioning": "LOWER_BUILT_FROM_SHARED_BUNDLE",
      "permittedTargetKinds": [
        "LOCAL_DETERMINISTIC_STUB",
        "LOCAL_FAULT_HARNESS",
        "LOWER_BUILT_CONTRACT_FAITHFUL_HARNESS",
        "LOWER_OWNED_IMPLEMENTATION_UNDER_TEST"
      ],
      "prohibitedTargetKinds": [
        "LIVE_E2_CONTROL",
        "LIVE_RAN_WRITE",
        "OTA_TRANSMISSION",
        "PEER_INTERNAL_SOURCE_IMPORT",
        "UPPER_PRODUCTION_DEPLOYMENT",
        "USRP_RADIO"
      ],
      "fixtureSource": {
        "origin": "SHARED_CONTRACT_BUNDLE_1_0_1",
        "mode": "EXACT_BUNDLE",
        "fixtureRefs": [
          "fixture://golden",
          "fixture://policy"
        ]
      },
      "oracleSource": {
        "origin": "SCENARIO_CATALOG_1_0_1",
        "expectedPointer": "/scenarios/0/expected",
        "rulesPointer": "/scenarios/0/rules"
      },
      "evidenceProducer": "LOWER_SIDE_CONFORMANCE_RUNNER",
      "evidenceLabel": "lower-local",
      "lowerDependencyClass_1_0_0": "HARDWARE_FREE_LOWER_PHASE_A",
      "rationale": "하위가 소유·운영하는 A1-P Producer를 shared bundle fixture와 하위가 만든 contract-faithful A1 Consumer harness만으로 실행한다. 상대 배포나 hardware가 필요하지 않다."
    },
    {
      "scenarioId": "SC-002",
      "catalogPointer": "/scenarios/1",
      "suite": "a1p-producer-conformance",
      "fixtureMode": "EXACT_BUNDLE",
      "executionProfile": "lower-local",
      "executedBy": "LOWER_SIDE_CONFORMANCE_RUNNER",
      "targetOwner": "LOWER_SIDE",
      "suiteTargetToken": "A1_P_PRODUCER",
      "selectedTargetRole": "A1_P_PRODUCER",
      "counterpartRole": "A1_CONSUMER_BLACK_BOX_HARNESS",
      "counterpartProvisioning": "LOWER_BUILT_FROM_SHARED_BUNDLE",
      "permittedTargetKinds": [
        "LOCAL_DETERMINISTIC_STUB",
        "LOCAL_FAULT_HARNESS",
        "LOWER_BUILT_CONTRACT_FAITHFUL_HARNESS",
        "LOWER_OWNED_IMPLEMENTATION_UNDER_TEST"
      ],
      "prohibitedTargetKinds": [
        "LIVE_E2_CONTROL",
        "LIVE_RAN_WRITE",
        "OTA_TRANSMISSION",
        "PEER_INTERNAL_SOURCE_IMPORT",
        "UPPER_PRODUCTION_DEPLOYMENT",
        "USRP_RADIO"
      ],
      "fixtureSource": {
        "origin": "SHARED_CONTRACT_BUNDLE_1_0_1",
        "mode": "EXACT_BUNDLE",
        "fixtureRefs": [
          "fixture://policy",
          "fixture://capabilityManifest"
        ]
      },
      "oracleSource": {
        "origin": "SCENARIO_CATALOG_1_0_1",
        "expectedPointer": "/scenarios/1/expected",
        "rulesPointer": "/scenarios/1/rules"
      },
      "evidenceProducer": "LOWER_SIDE_CONFORMANCE_RUNNER",
      "evidenceLabel": "lower-local",
      "lowerDependencyClass_1_0_0": "HARDWARE_FREE_LOWER_PHASE_A",
      "rationale": "하위가 소유·운영하는 A1-P Producer를 shared bundle fixture와 하위가 만든 contract-faithful A1 Consumer harness만으로 실행한다. 상대 배포나 hardware가 필요하지 않다."
    },
    {
      "scenarioId": "SC-003",
      "catalogPointer": "/scenarios/2",
      "suite": "a1p-producer-conformance",
      "fixtureMode": "EXACT_BUNDLE",
      "executionProfile": "lower-local",
      "executedBy": "LOWER_SIDE_CONFORMANCE_RUNNER",
      "targetOwner": "LOWER_SIDE",
      "suiteTargetToken": "A1_P_PRODUCER",
      "selectedTargetRole": "A1_P_PRODUCER",
      "counterpartRole": "A1_CONSUMER_BLACK_BOX_HARNESS",
      "counterpartProvisioning": "LOWER_BUILT_FROM_SHARED_BUNDLE",
      "permittedTargetKinds": [
        "LOCAL_DETERMINISTIC_STUB",
        "LOCAL_FAULT_HARNESS",
        "LOWER_BUILT_CONTRACT_FAITHFUL_HARNESS",
        "LOWER_OWNED_IMPLEMENTATION_UNDER_TEST"
      ],
      "prohibitedTargetKinds": [
        "LIVE_E2_CONTROL",
        "LIVE_RAN_WRITE",
        "OTA_TRANSMISSION",
        "PEER_INTERNAL_SOURCE_IMPORT",
        "UPPER_PRODUCTION_DEPLOYMENT",
        "USRP_RADIO"
      ],
      "fixtureSource": {
        "origin": "SHARED_CONTRACT_BUNDLE_1_0_1",
        "mode": "EXACT_BUNDLE",
        "fixtureRefs": [
          "fixture://policy",
          "fixture://capabilityManifest"
        ]
      },
      "oracleSource": {
        "origin": "SCENARIO_CATALOG_1_0_1",
        "expectedPointer": "/scenarios/2/expected",